[
  {
    "id": "354cef49-4e07-4480-b1a3-df5d532acf8d",
    "concept": "Sine wave",
    "animation_path": "output\\animations\\Sine_wave_text_animation.txt",
    "duration": 8,
    "target_audience": "high_school",
    "animation_type": "gif",
    "model_used": "text_fallback",
    "created_at": "2025-09-16T16:06:23.461985+00:00",
    "file_size": 381,
    "resolution": "720p",
    "quality": "high",
    "learning_goals": [
      "Understand sine wave mathematical properties",
      "Visualize amplitude, frequency, and phase relationships",
      "Explain sine wave applications in physics and engineering",
      "Apply trigonometric functions to wave analysis"
    ],
    "key_learning_points": [
      "Sine waves are fundamental to wave analysis",
      "Amplitude determines wave strength",
      "Frequency determines wave speed",
      "Phase shift affects wave timing"
    ],
    "tricky_questions": [
      "How do you calculate sine wave frequency?",
      "What causes phase shifts in waves?",
      "How do you add two sine waves together?",
      "What are the applications of sine waves in technology?"
    ],
    "educational_value": 8
  },
  {
    "id": "efaab40a-6e9f-4f12-9764-050ee62bb0d9",
    "concept": "Pendulum motion",
    "animation_path": "output\\animations\\Pendulum_motion_text_animation.txt",
    "duration": 8,
    "target_audience": "high_school",
    "animation_type": "gif",
    "model_used": "text_fallback",
    "created_at": "2025-09-16T16:06:25.477739+00:00",
    "file_size": 399,
    "resolution": "720p",
    "quality": "high",
    "learning_goals": [
      "Understand simple harmonic motion principles",
      "Visualize the relationship between displacement and restoring force",
      "Explain how pendulum length affects period",
      "Apply energy conservation in oscillatory motion"
    ],
    "key_learning_points": [
      "Period depends only on length and gravity, not mass",
      "Energy oscillates between kinetic and potential",
      "Amplitude affects maximum speed but not period",
      "Small angle approximation simplifies calculations"
    ],
    "tricky_questions": [
      "Why doesn't pendulum period depend on mass?",
      "How does air resistance affect pendulum motion?",
      "What happens when pendulum amplitude increases?",
      "How do you calculate pendulum energy at different positions?"
    ],
    "educational_value": 8
  },
  {
    "id": "79368ada-1fff-4da0-a7d6-1b438b4746c1",
    "concept": "Chemical reactions",
    "animation_path": "output\\animations\\Chemical_reactions_text_animation.txt",
    "duration": 8,
    "target_audience": "high_school",
    "animation_type": "gif",
    "model_used": "text_fallback",
    "created_at": "2025-09-16T16:06:27.482809+00:00",
    "file_size": 408,
    "resolution": "720p",
    "quality": "high",
    "learning_goals": [
      "Understand molecular bonding and breaking",
      "Visualize energy changes during reactions",
      "Explain activation energy and catalysts",
      "Apply conservation of mass and energy"
    ],
    "key_learning_points": [
      "Bonds break and form during chemical reactions",
      "Activation energy is required to start reactions",
      "Catalysts lower activation energy",
      "Mass and energy are conserved in reactions"
    ],
    "tricky_questions": [
      "How do catalysts speed up reactions?",
      "Why do some reactions require heat to start?",
      "What determines reaction rate?",
      "How do you balance chemical equations?"
    ],
    "educational_value": 8
  }
]